id,question_id,created,updated,content,creator,is_spam,num_helpful,num_unhelpful
1762928,1528645,2025-09-08 18:15:35 -0700,2025-09-08 18:15:35 -0700,<p>Thanks for fixing this! </p>,spartanhooah,false,0,0
1759682,1528682,2025-08-25 19:09:10 -0700,2025-08-25 19:09:10 -0700,"<p>There is not currently a plan to do so, but you can vote for such a feature at <a href=""https://connect.mozilla.org/t5/ideas/for-thunderbird-android-app-add-quot-spam-quot-button/idi-p/93719"" rel=""nofollow"">https://connect.mozilla.org/t5/ideas/for-thunderbird-android-app-add-quot-spam-quot-button/idi-p/93719</a> </p>",wsmwk,false,0,0
1756226,1528813,2025-08-13 04:46:04 -0700,2025-08-13 04:46:04 -0700,"<p>Maybe the mapping of folders is not correct. If this is the case, then the following steps might be helpful: ""Settings"" &gt; ""Accounts"" section &gt; Tap the account you want to configure &gt; ""Folders"" &gt; ""Sent folder"" &gt; Choose the folder you prefer &gt; Press back (◀) button of Android phone. </p>",Yu5tiqX9og,false,0,0
1756400,1528813,2025-08-13 12:11:05 -0700,2025-08-13 12:11:05 -0700,"<p>Hi there! Tried it but it didn't resolve it. The folder was set to ""Automatic (Sent)"" and I changed it to ""Sent"". </p>",dfuentes33024,false,0,0
1756409,1528813,2025-08-13 12:29:37 -0700,2025-08-13 12:29:37 -0700,"<p>UPDATE: I just deleted my account, uninstalled and reinstalled Thunderbird and everything seems to be working well again. Thanks to everyone for all the help! Much appreciated. </p>",dfuentes33024,false,0,0
1763808,1528813,2025-09-12 10:11:31 -0700,2025-09-12 10:24:27 -0700,"<p>Same issue:   K9-mail user since 2010, no config changes made in many months, if not years. </p><p>sent folder empty, all folders other than inbox, also empty. Inbox works. All other folders are empty, show 'Load 25 more', but won't fetch any messages. </p><p>Problem effects two accounts.  Both IMAP, hosted on cPanel. A third account hosted on fastmail works fine. </p><p>Tried deleting, re-adding the account: no change. </p><p>Export settings, uninstall app, re-install app, import settings, re-enter passwords ..- </p><pre>--  at first, appeared to still be broken ,, --  but several minutes later, folders began populating. </pre>",shawn..,false,0,0
