id,created,updated,locale,product,title,is_solved,solution,solved_by,is_spam,last_answer,answers,topic,tags,creator,content,involved,is_archived,is_locked,is_taken,metadata,num_answers,num_votes_past_week,num_votes,taken_until,taken_by,updated_by
1517971,2025-06-19 17:36:35 -0700,2025-06-19 17:36:35 -0700,en-US,thunderbird-android,Importing MBOX to Thunderbird for Android,false,,,false,,"",import-and-export-email,thunderbird-android;import-and-export-email;,niktizek,"<p>I looked up how to import from Gmail into Thunderbird but, after doing an export from Gmail to MBOX, realised the instructions appear to be for Thunderbird for desktop. </p><p>I'm using POP/SMTP. </p><p>So I have my email sitting in an MBOX file on my phone, but I can't find any instructions on how to import the email to Thunderbird for Android. </p><p>I moved to Thunderbird for Android, away from K9mail, because K9 wouldn't seem to download all my messages.  Worked fine for a while, then just started downloading one email per fetch even though there were hundreds yet more to download. </p><p>I read about the import feature for Thunderbird and so installed onto both PC and mobile phone.  Now I can't see how to get the mail onto the phone. </p><p>I've been searching for more than 24 hours now for a solution.  It probably doesn't help that a search for Thunderbird for Android still brings up solutions for Thunderbird for desktop. </p><p>Can anyone here assist? </p>",niktizek;,true,false,false,;useragent:Mozilla/5.0 (Windows NT 10.0; Win64; x64; rv:128.0) Gecko/20100101 Firefox/128.0;os:Android and Windows 10,0,0,0,,,
1517974,2025-06-19 18:17:55 -0700,2025-06-19 18:17:55 -0700,en-US,thunderbird-android,Broken search on Android?,false,,,false,,"",accessibility,thunderbird-android;accessibility;,elmerbug,"<p>Search stopped working on my Windows 11 and Android platforms.  I deleted the global database and restarted Thunderbird on Windows 11.  Problem solved.  Unfortunately, on Android, no joy. </p>",elmerbug;,true,false,false,";useragent:Mozilla/5.0 (Windows NT 10.0; Win64; x64) AppleWebKit/537.36 (KHTML, like Gecko) Chrome/137.0.0.0 Safari/537.36",0,0,0,,,
1518012,2025-06-20 00:28:10 -0700,2025-06-21 13:42:10 -0700,en-US,thunderbird-android,Thunderbird on Android closes when rotating phone,false,,,false,1743517,1743517;,performance-and-connectivity,thunderbird-android;performance-and-connectivity;,al45,"<p>I'm using 11.0b3 on android v11. Just starting with this release, when I rotate my phone from portrait to landscape Thunderbird closes </p>",al45;Yu5tiqX9og;,true,false,false,;useragent:Mozilla/5.0 (Android 11; Mobile; rv:139.0) Gecko/139.0 Firefox/139.0,1,0,0,,,
1518015,2025-06-20 00:36:57 -0700,2025-06-21 13:44:00 -0700,en-US,thunderbird-android,"Thunderbird on Android - ""Download complete message"" button is hidden by the navigation buttons",false,,,false,1743515,1743515;,email-and-messaging,thunderbird-android;email-and-messaging;,al45,"<p>Running 11.0b3 on Android 11. </p><p>When I open a message I am no longer able to click at the bottom of the message to ""Download complete message"". This has been happening for a couple of beta releases now. I guess that this is only a problem when using the navigation buttons but although I use gestures on my tablet, I don't like them on my phone. </p><p>Thanks </p>",al45;Yu5tiqX9og;,true,false,false,;useragent:Mozilla/5.0 (Android 11; Mobile; rv:139.0) Gecko/139.0 Firefox/139.0,1,0,0,,,
1518069,2025-06-20 07:07:17 -0700,2025-06-26 13:12:25 -0700,en-US,thunderbird-android,"Add Gmail account, how?",false,,,false,,"",accounts,thunderbird-android;accounts;,pg.zapata,<p><strong>I can't add my gmail account. </strong> Android and Windows 11<strong></strong> </p>,pg.zapata;,true,false,false,";os:Android, and Windows 11;useragent:Mozilla/5.0 (Linux; Android 10; K) AppleWebKit/537.36 (KHTML, like Gecko) Chrome/137.0.0.0 Mobile Safari/537.36 OPR/90.0.0.0;kb_visits_prior:[""/en-US/kb/gmail-thunderbird-android""]",0,0,0,,,Noah_SUMO
1518099,2025-06-20 09:48:05 -0700,2025-06-20 09:48:05 -0700,en-US,thunderbird-android,Filter Settings in Thunderbird for Android,false,,,false,,"",settings,android;thunderbird-android;settings;,lasse,"<p>Where can I find the settings for filters in Thunderbird for Android? I could import all my accounts with many folders from my desktop, but the filters do not work on my smartphone the way they work on my desktop. </p>",lasse;,true,false,false,";useragent:Mozilla/5.0 (Windows NT 10.0; Win64; x64) AppleWebKit/537.36 (KHTML, like Gecko) Chrome/134.0.0.0 Safari/537.36 OPR/119.0.0.0;os:Android;kb_visits_prior:[""/en-US/kb/thunderbird-android-import""]",0,0,0,,,
