id,created,updated,locale,product,title,is_solved,solution,solved_by,is_spam,last_answer,answers,topic,tags,creator,content,involved,is_archived,is_locked,is_taken,metadata,num_answers,num_votes_past_week,num_votes,taken_until,taken_by,updated_by
1530592,2025-08-20 19:43:02 -0700,2025-09-04 16:17:58 -0700,en-US,thunderbird-android,Want to cancel my subscription,false,,,false,1762018,1758758;1761630;1762018;,passwords-and-sign-in,android;thunderbird-android;passwords-and-sign-in;,parkerlynn354,"<p>Tell you the truth, I would like to cancel my subscription for this account  I never meant too download it ,just accidentally </p>",parkerlynn354;shopov.bogomil;plwt;,false,false,false,";useragent:Mozilla/5.0 (Linux; Android 10; K) AppleWebKit/537.36 (KHTML, like Gecko) Chrome/139.0.0.0 Mobile Safari/537.36;os:Android;kb_visits_prior:[""/en-US/kb/gmail-thunderbird-android""]",3,0,1,,,
1530647,2025-08-21 02:18:43 -0700,2025-08-26 00:55:29 -0700,en-US,thunderbird-android,Can't update from Thunderbird-Android 11 to 11.1,false,,,false,1759735,1759650;1759735;,update,thunderbird-android;update;,rdscorreia74,"<p>As stated, I can't update Thunderbird on Android from v11 to the newest v11.1. Apparently this is an App ID fingerprint issue. Has Mozilla changed the App ID from v11 to v11.1? Thanks in advance. Cheers </p>",rdscorreia74;wsmwk;,false,false,false,";useragent:Mozilla/5.0 (X11; Linux x86_64; rv:142.0) Gecko/20100101 Firefox/142.0;os:Android 11 on Samsung One UI 3.1;kb_visits_prior:[""/en-US/kb/thunderbird-android-8-faq""]",2,0,0,,,
1530709,2025-08-21 08:56:34 -0700,2025-09-02 13:59:48 -0700,en-US,thunderbird-android,Can I import my addresses on PC Thunderbird to Android Thunderbird on my phone,true,1761508,wsmwk,false,1761508,1761508;,contacts,android;thunderbird-android;contacts;,nfh6521030,<p>Can I import my addresses on PC Thunderbird to Android Thunderbird on my phone </p>,nfh6521030;wsmwk;,false,false,false,";os:Android;solver_id:6968207;useragent:Mozilla/5.0 (Linux; Android 10; K) AppleWebKit/537.36 (KHTML, like Gecko) Chrome/139.0.0.0 Mobile Safari/537.36",1,0,2,,,wsmwk
1530717,2025-08-21 09:23:15 -0700,2025-08-29 05:16:56 -0700,en-US,thunderbird-android,Closing Android App,true,1760454,kevin.prawl,false,1760454,1758765;1758770;1759450;1760434;1760454;,undefined,thunderbird-android;undefined;,kevin.prawl,<p>I cannot close the Thunderbird email app on Samsung Galaxy S25 Ultra Android 16 One UI 8.0. The back arrow in the navigation bar no long closes the app windows. Have to use the back to home center button. Is there a solution to this problem? </p>,kevin.prawl;shopov.bogomil;,false,false,false,";solver_id:6380502;useragent:Mozilla/5.0 (Linux; Android 10; K) AppleWebKit/537.36 (KHTML, like Gecko) Chrome/139.0.0.0 Mobile Safari/537.36",5,0,1,,,
1530732,2025-08-21 10:38:53 -0700,2025-08-21 10:38:53 -0700,en-US,thunderbird-android,Creating your own directories – jeśli chodzi o katalogi komputerowe/foldery.  Creating your own catalogs,false,,,false,,"",settings,android;thunderbird-android;settings;,lufa9999,"<p>Hello, Today I installed an app on Android 15. The program is really great and suits me very well. I have a problem. How can I create a new folder in the app? There’s a lot about it on the internet, but everything is useless. I would be very grateful for your help. Best regards, Pawel Fraczkiewicz </p>",lufa9999;,false,false,false,";useragent:Mozilla/5.0 (Linux; Android 10; K) AppleWebKit/537.36 (KHTML, like Gecko) Chrome/139.0.0.0 Mobile Safari/537.36;os:Android",0,0,0,,,
