id,created,updated,locale,product,title,is_solved,solution,solved_by,is_spam,last_answer,answers,topic,tags,creator,content,involved,is_archived,is_locked,is_taken,metadata,num_answers,num_votes_past_week,num_votes,taken_until,taken_by,updated_by
1529598,2025-08-15 18:32:09 -0700,2025-12-12 05:22:42 -0800,en-US,thunderbird-android,Can't send e-mail,false,,,false,1785556,1757272;1757274;1757833;1785551;1785556;,send-and-receive-email,android;thunderbird-android;send-and-receive-email;,khindall,"<p>I've been ""sending"" e-mail from my Android phone for six weeks now. It looks like it's going out, but it never gets outside the domain.  </p><p>I found the suggestion that I check my SMTP settings, but I used a wizard within TB for Mac so I cannot find the SMTP settings on the phone. </p><p>The wizard wasn't very wizard: I don't have the contacts stored within TB or the mail from my computer or anything. All I can do is receive e-mail.  </p><p>I really need to get this working. My computer has died, and everything is going via the phone, and I only use e-mail for communication, not voice or text. (Long story, please don't argue with me about that.) </p><p>I just updated Android again yesterday, and TB should be upgrading automatically, if I have this thing set right.  </p><p>Update: I have found the SMTP settings. They look correct.  </p><p>My sister's e-mail is working, so the problem is definitely with my settings somehow.  </p><p>Does anyone have any ideas? I really want to stick with TB.  </p><p>Update 2: I found the debugging settings and turned on extra logging, but I can't find the logs themselves. Could someone point me to them? </p><p>I also tried the TB beta because it says explicitly that it does POP3, but that didn't seem to help either.  </p><p>Now that I can edit my question, how do I delete the answers that are actually just updates?  </p><p>Update 4: A different app works. I'd rather use TB if it can be arranged, though. . . . </p><p>Any help would be appreciated! </p><p>Thank you! </p>",khindall;mozi3;wsmwk;,false,false,false,";os:Android;useragent:Mozilla/5.0 (Android 15; Mobile; rv:141.0) Gecko/141.0 Firefox/141.0;kb_visits_prior:[""/en-US/kb/configure-push-email-thunderbird-android""]",5,0,1,,,khindall
1529668,2025-08-16 05:52:13 -0700,2025-08-28 10:01:20 -0700,en-US,thunderbird-android,Cannot distinguish between read and unread messages on Android v10,true,1759648,wsmwk,false,1760286,1759648;1760286;,accessibility,thunderbird-android;accessibility;,lord.of.internet,"<p>Hello there  I have Thunderbird for Android, version 10.1, and in every folder, all mail, both read and unread, have almost the same appearance. It's not easy to tell which ones in the list are read and which are unread. Is there any setting to turn the unread messages in the folder look highlighted, or more bold, or something different anyway than the rest? Because this way it's very inconvenient, which makes me considering turning back to Outlook. Thanks in advance </p>",lord.of.internet;wsmwk;,false,false,false,";solver_id:6955543;useragent:Mozilla/5.0 (Linux; Android 10; K) AppleWebKit/537.36 (KHTML, like Gecko) Chrome/139.0.0.0 Mobile Safari/537.36",2,0,1,,,wsmwk
1529694,2025-08-16 09:44:31 -0700,2025-08-16 09:44:31 -0700,en-US,thunderbird-android,firwarding links on Android tablet,false,,,false,,"",send-and-receive-email,android;thunderbird-android;send-and-receive-email;,Spider22,<p>When I forward a link in my android tablet it does not show in the email that someone receiving the email can click on to open &nbsp;???? </p>,Spider22;,false,false,false,;useragent:Mozilla/5.0 (Android 13; Mobile; rv:141.0) Gecko/141.0 Firefox/141.0;os:Android,0,0,0,,,
1529697,2025-08-16 09:56:06 -0700,2025-08-17 09:24:36 -0700,en-US,thunderbird-android,Header,false,,,false,1757601,1757418;1757601;,accessibility,thunderbird-android;accessibility;,fare.s,"<p>I'm looking for an Android email client that only shows the headers and optionally shows/download the body of the email and any attachments. The reason is that this way I can save space on my phone while maintaining the convenience of a mail client. I read that K9-Mail, now integrated with Thunderbird, has this selectable feature. Is this true? If so, I'll proceed with installing Thunderbird. </p>",fare.s;Thundamike;,false,false,false,";useragent:Mozilla/5.0 (Linux; Android 10; K) AppleWebKit/537.36 (KHTML, like Gecko) Chrome/139.0.0.0 Mobile Safari/537.36",2,0,0,,,
1529714,2025-08-16 11:27:20 -0700,2025-09-02 17:36:08 -0700,en-US,thunderbird-android,how do I create  additional folders? Unable to find way.,false,,,false,1761547,1761547;,email-and-messaging,android;thunderbird-android;email-and-messaging;,jablair,<p>Iam unable to find how/where to create additional folders. With desktop version I have created a number of folders. I like organize and segregate my emails into various groups. Especially the ones I choose to preserve rather than delete. </p>,jablair;wsmwk;,false,false,false,;useragent:Mozilla/5.0 (X11; Linux x86_64; rv:141.0) Gecko/20100101 Firefox/141.0;os:android,1,0,0,,,
