id,created,updated,locale,product,title,is_solved,solution,solved_by,is_spam,last_answer,answers,topic,tags,creator,content,involved,is_archived,is_locked,is_taken,metadata,num_answers,num_votes_past_week,num_votes,taken_until,taken_by,updated_by
1575393,2026-04-08 18:34:09 -0700,2026-04-08 18:34:09 -0700,en-US,thunderbird-android,please resize your window,false,,,true,,"",passwords-and-sign-in,android;thunderbird-android;passwords-and-sign-in;,whozade,"<p>Please resize your window to 200×300 im on android s25 ultra i change password and this happens <a href=""mailto:driver2hire@aol.com"" rel=""nofollow"">driver2hire@aol.com</a> </p>",whozade;,false,false,false,;useragent:Mozilla/5.0 (Android 16; Mobile; rv:149.0) Gecko/149.0 Firefox/149.0;os:Android,0,0,0,,,
1575399,2026-04-08 18:54:31 -0700,2026-04-08 18:54:31 -0700,en-US,thunderbird-android,Every Email Has Its Own Notification / Notifications Do Not Clear,false,,,false,,"",customization,thunderbird-android;customization;,phumphries,"<p>Since the last update (I am running K-9 Mail v17.0 on a Moto G Stylus 5G 2023 with Android 14 Build Number U1TGNS34.42-86-4-5-4-8), I am often getting a separate notification for every new email in my In Box (POP3) instead of one notification to say that I have a bunch of new messages, and the notification(s) is(are) not going away after I look at my message(s) and delete the email(s). </p><p>Any idea if this is a bug or a feature?  It is annoying to delete 10 emails and then have to delete 10 notifications about the same 10 emails. </p><p>Thanks in advance for your thoughts. </p>",phumphries;,false,false,false,;useragent:Mozilla/5.0 (Windows NT 10.0; Win64; x64; rv:149.0) Gecko/20100101 Firefox/149.0;tb_version:17.0;os:Android 14,0,0,0,,,
1575450,2026-04-09 01:19:38 -0700,2026-04-09 07:56:57 -0700,en-US,thunderbird-android,"Неработает почтовый клиент на андроид, нет синхронизации",false,,,false,1810901,1810901;,connectivity,android;thunderbird-android;connectivity;,serg.galkin2000,"<p>Неработает почтовый клиент для андроид, нет синхронизации </p>",serg.galkin2000;platform34;,false,false,false,";useragent:Mozilla/5.0 (Linux; Android 10; K) AppleWebKit/537.36 (KHTML, like Gecko) Chrome/146.0.0.0 Mobile Safari/537.36;os:Android",1,0,0,,,
1575473,2026-04-09 05:36:59 -0700,2026-04-09 06:20:22 -0700,en-US,thunderbird-android,Automatically complete email addresses as they are entered and generate the email address from the user's full name.,true,1810892,dirk68,false,1810892,1810892;,contacts,android;thunderbird-android;contacts;,dirk68,"<p>Hello, I can't find a way to connect my contact database to Thunderbird for Android. How can I set this up so that email addresses can be easily added or imported automatically in the entry fields of a new email? Thanks in advance! Regards </p>",dirk68;,false,false,false,";useragent:Mozilla/5.0 (Android 16; Mobile; rv:149.0) Gecko/149.0 Firefox/149.0;os:Android;kb_visits_prior:[""/en-US/kb/thundermail-and-thunderbird-android""];solver_id:7543011",1,0,0,,,
1575515,2026-04-09 11:56:13 -0700,2026-04-11 15:28:44 -0700,en-US,thunderbird-android,Missing folders in email account after Exporting from Desktop Thunderbird,true,1810958,platform34,false,1811247,1810958;1811247;,import-and-export-email,thunderbird-android;import-and-export-email;,sealion,"<p>I exported all my 5 email accounts from Desktop Thunderbird to mobile Thunderbird. All were successful except for two accounts which only have one folder visible, the Outbox. All accounts are sycnhed and Manage Folders displays no folders. Help please to resolve problem. </p>",sealion;platform34;,false,false,false,;useragent:Mozilla/5.0 (Windows NT 10.0; Win64; x64; rv:149.0) Gecko/20100101 Firefox/149.0;tb_version:140.9.0esr 64 bit;os:Win11;solver_id:1061508,2,0,0,,,
1575547,2026-04-09 15:14:26 -0700,2026-04-09 17:16:20 -0700,en-US,thunderbird-android,cannot send emails,false,,,false,1810990,1810990;,send-and-receive-email,android;thunderbird-android;send-and-receive-email;,BobSledUSA,"<p>I am unable to send emails from android Thunderbird, I have something called a unified mailbox plus 2 that have my correct email address. When I send an email it sits in the outbox of the first one with my correct email address and won't send even after selecting send messages. Why do I have a unified mailbox plus 2 others? Thanks </p>",BobSledUSA;platform34;,false,false,false,;useragent:Mozilla/5.0 (Android 16; Mobile; rv:149.0) Gecko/149.0 Firefox/149.0;os:Android,1,0,0,,,
