id,created,updated,locale,product,title,is_solved,solution,solved_by,is_spam,last_answer,answers,topic,tags,creator,content,involved,is_archived,is_locked,is_taken,metadata,num_answers,num_votes_past_week,num_votes,taken_until,taken_by,updated_by
1576380,2026-04-14 17:49:18 -0700,2026-04-14 17:49:18 -0700,en-US,thunderbird-android,Tailored Financing Solutions for Your Projects with Mark Davson Financial Loan Firm +447300935913.,false,,,true,,"",settings,thunderbird-android;settings;,bonifacealejandrofernandez,"<p>Tailored Financing Solutions for Your Projects with Mark Davson Financial Loan Firm +447300935913. </p><p>Attention </p><p>We are pleased to introduce Mark Davson Financial Loan Firm, a trusted financial institution committed to supporting your real estate, business, and personal projects. </p><p>Do you have a project that requires funding? Our finance investment on a short term loan is  $10,000,000.00 USD to $100,000,000.00 USD. Our long term loan investment is from $100,000,000.00 USD to 800,000,000.00 USD and above We offer loans to Individuals from the range of $ 10,000.00 USD  to $ 50,000,000.00 USD. Our loan interest rate is 2% and the Loan repayment duration ranges from 1 year to 35 years. duration. Once customer's receive our loan offers, the loan repayment starts after a 1 year grace period. </p><p>Our financing solutions cover: •Real Estate Loans: property purchase, land acquisition, construction, renovation. •Business Loans: business start-up, expansion, equipment, working capital. •Personal Loans: education, wedding, travel, and other personal needs. </p><p>Why choose Mark Davson Financial Loan Firm? ✅ Personalized assessment of your application ✅ Fast and simple procedures ✅ Tailored support at every step ✅ Transparency, confidentiality, and reliability </p><p>📩 To learn more or submit your loan application, please contact us today at emails: <a href=""mailto:markdavsonfinancialloanfirm@consultant.com"" rel=""nofollow"">markdavsonfinancialloanfirm@consultant.com</a> Now our company is also looking for a person that can be our company representative in your country. If you are interest to be our company representative in your country, kindly contact us via below emails. </p><p>We look forward to helping you bring your projects to life. </p><p>Sincerely, Management </p><p>Thank you C.E.O. Rev. Mark Davson MARK DAVSON FINANCIAL LOAN FIRM United Kingdom, England (UK) Email: <a href=""mailto:markdavsonfinancialloanfirm@consultant.com"" rel=""nofollow"">markdavsonfinancialloanfirm@consultant.com</a> Email:<a href=""mailto:markdavsonfinancialloanfirm@gmail.com"" rel=""nofollow"">markdavsonfinancialloanfirm@gmail.com</a> Email: <a href=""mailto:markdavsonfinancialloanservice@gmail.com"" rel=""nofollow"">markdavsonfinancialloanservice@gmail.com</a> Email: <a href=""mailto:markdavsonloanfirm@hotmail.com"" rel=""nofollow"">markdavsonloanfirm@hotmail.com</a> WhatsApp:+447300935913 Website: <a href=""https://markdavsonfinancialloanfirm.com/"" rel=""nofollow"">https://markdavsonfinancialloanfirm.com/</a> </p>",bonifacealejandrofernandez;,false,false,false,";useragent:Mozilla/5.0 (Windows NT 10.0; Win64; x64) AppleWebKit/537.36 (KHTML, like Gecko) Chrome/147.0.0.0 Safari/537.36;tb_version:17.0",0,0,0,,,
1576382,2026-04-14 18:21:36 -0700,2026-04-14 18:21:36 -0700,en-US,thunderbird-android,Email stuck in outbox,false,,,false,,"",send-and-receive-email,thunderbird-android;send-and-receive-email;,catweazle883311,"<p>Hello, this problem is driving me mad and I am at the point where I give up with Thunderbird  </p><p>What's happening is ""random"" emails go into the outbox and stay there,  I have no choice but to delete them.  </p><p>There is no rhyme or reason for this. </p><p>The majority of emails send, even to the address that will randomly stay in outbox. !! </p><p>I have deleted the account and reinstalled it, used the same settings that are on another account that I don't have a problem with. </p><p>I am using android on galaxy tablet. </p><p>Anyone have any ideas  </p><p>Thanks </p>",catweazle883311;,false,false,false,";useragent:Mozilla/5.0 (X11; Linux x86_64) AppleWebKit/537.36 (KHTML, like Gecko) Chrome/146.0.0.0 Safari/537.36;tb_version:17.0",0,0,0,,,
1576502,2026-04-15 11:09:23 -0700,2026-04-15 19:37:36 -0700,en-US,thunderbird-android,outmail folder only,false,,,false,1811966,1811966;,send-and-receive-email,android;thunderbird-android;send-and-receive-email;,skwalsh30,<p>Gmail account only had outmail folder </p>,skwalsh30;platform34;,false,false,false,;useragent:Mozilla/5.0 (Android 16; Mobile; rv:149.0) Gecko/149.0 Firefox/149.0;tb_version:17.0;os:Android,1,0,0,,,
1576505,2026-04-15 11:41:47 -0700,2026-04-15 15:13:24 -0700,en-US,thunderbird-android,"Can I format text (bold, italic, underlined) in Thunderbird?",false,,,false,1811920,1811920;,customization,android;thunderbird-android;customization;,cpoticha,"<p>When composing emails in Thunderbird for Android, I can't find any options to format text.  </p><p>I can't select a typeface (even the most basic html tags for serif/sans-serif/monospace aren't available) or even make text bold, italic or underlined.  </p><p>This makes it very hard to create emphasis where necessary, and it feels like ancient emails from before HTML formatting.  </p><p>Is there something I am missing, or does this depend on the phone?  </p><p>NB: I can do this with my messaging apps and the Gmail app, which I prefer not to use.  </p><p>Sony Xperia 10 V Android 14 </p>",cpoticha;platform34;,false,false,false,";useragent:Mozilla/5.0 (Linux; Android 10; K) AppleWebKit/537.36 (KHTML, like Gecko) Chrome/146.0.0.0 Mobile Safari/537.36;tb_version:17.0;os:Android",1,0,0,,,
1576535,2026-04-15 15:12:13 -0700,2026-04-15 19:24:05 -0700,en-US,thunderbird-android,How to transfer emails from Thunderbird Desktop to Thunderbird Android?,false,,,false,1811962,1811926;1811958;1811962;,import-and-export-email,thunderbird-android;import-and-export-email;needsinfo;,lafargeotte,"<p>Hi, </p><p>How do I transfer emails from Thunderbird Desktop to Thunderbird Android? </p><p>I have successfully imported my settings, but I want to add all my emails that are currently on my desktop. </p><p>How do I do it please? </p>",lafargeotte;platform34;,false,false,false,";useragent:Mozilla/5.0 (Windows NT 10.0; Win64; x64; rv:149.0) Gecko/20100101 Firefox/149.0;tb_version:Android 17;os:Android 16, Windows 11;kb_visits_prior:[""/en-US/kb/thunderbird-android-import"", ""/en-US/kb/thunderbird-android-8-faq""]",3,0,0,,,
1576543,2026-04-15 15:58:43 -0700,2026-04-15 19:36:26 -0700,en-US,thunderbird-android,Android installation of TB 'stuck' in outboxes,false,,,false,1811965,1811965;,send-and-receive-email,thunderbird-android;send-and-receive-email;,dalemwebb12181,<p>Imported desktop settings to TB Android on my phone.  Used your instructions and seemed to go well (done it before).  Android install of both Gmail accounts I imported are 'stuck' showing ONLY the outboxes.  Can't get anywhere else.  What do I need to do to correct the install on my phone.  Desktop install was done manually and seems to work. </p>,dalemwebb12181;platform34;,false,false,false,";useragent:Mozilla/5.0 (Windows NT 10.0; Win64; x64) AppleWebKit/537.36 (KHTML, like Gecko) Chrome/147.0.0.0 Safari/537.36;tb_version:Desktop is 149;os:Android 16, OneUI 8,5;kb_visits_prior:[""/en-US/kb/thunderbird-android-import""]",1,0,0,,,
