id,question_id,created,updated,content,creator,is_spam,num_helpful,num_unhelpful
1803475,1568760,2026-03-03 02:54:30 -0800,2026-03-03 02:54:30 -0800,"<p>OAuth already works with Gmail POP3 accounts (so I have read - I don't use that configuration.) Check out the following article for hints. What I get out of a quick scan of it is that you first need to set the SMTP server to use OAuth, then it should be available for the POP3 server. </p><p><a href=""https://support.mozilla.org/en-US/kb/thunderbird-and-gmail#w_updating-a-gmail-account-to-use-oauth"" rel=""nofollow"">https://support.mozilla.org/en-US/kb/thunderbird-and-gmail#w_updating-a-gmail-account-to-use-oauth</a> </p>",rednoise,false,0,0
1803500,1568760,2026-03-03 07:56:10 -0800,2026-03-03 07:56:10 -0800,"<p>Thanks, Lin, but I think this refers to the desktop version. When setting up, in the Android version, 0Auth2 doesn't appear, in the Authentication method box. (And, as far as I can see, the server settings pages can only be accessed on setting up the account, rather than being tweakable, afterwards, as in the desktop version. I could be wrong, here.) </p><p>If you try to clone already set up desktop settings (QR code etc) then the Android version ends up as IMAP. </p><p>I'd be delighted to learn that I've misunderstood something.  </p><p>Cheers </p>",Luddite,false,0,0
1803592,1568760,2026-03-03 16:11:27 -0800,2026-03-03 16:11:27 -0800,"<p>Oops, you're right, I totally glossed over the Android part of your question. I don't use Thunderbird for Android, but I used to use K-9 Mail, which you probably know is what Tbird Android is based upon. I'm sure it's changed since then, but I do remember that all server settings were available to be edited, but some of them were buried in there in hard-to-find places. </p>",rednoise,false,0,0
1803720,1568760,2026-03-04 06:41:08 -0800,2026-03-04 07:20:22 -0800,"<p>As you note TBA doesn't support oAuth with pop3 connections.  </p><p>Per the comments in the github link below. <em>""While we're not removing POP3 support at the moment, it isn't something we want to focus on""</em> </p><p><a href=""https://github.com/thunderbird/thunderbird-android/issues/9094#issuecomment-2842184393"" rel=""nofollow"">https://github.com/thunderbird/thunderbird-android/issues/9094#issuecomment-2842184393</a> </p><p>Have you tried creating a Gmail app password for Thunderbird. See link below. You can use this method instead of Oauth with TBA pop3 connections. This creates a 16 digit code which you enter in TBA instead of your main account password.  </p><p><a href=""https://support.google.com/mail/answer/185833?hl=en"" rel=""nofollow"">https://support.google.com/mail/answer/185833?hl=en</a> </p>",platform34,false,0,0
1803768,1568760,2026-03-04 12:07:11 -0800,2026-03-04 12:07:11 -0800,"<p>Very many thanks, Platform34. By chance, I had stumbled upon App Passwords, last night, but thought it might be out of date. Your post reassured.  </p><p>I've now tried it and, while it appeared to work, fear I've misunderstood something or done something stupid. Testing shows the following, with two mobile devices and one desktop device. </p><p>1. Email appears to send OK 2. Once email has been received on any of the devices, it won't appear on either of the others, even if it hasn't been opened or deleted.  </p><p>To my, admittedly untrained, eye, this looks more like exaggerated IMAP behaviour than the POP behaviour I was seeking. On desktop, I've set ""delete from server"" to 30 days, so I don't think it's that. </p><p>Have I done something silly? </p>",Luddite,false,0,0
1803771,1568760,2026-03-04 12:38:41 -0800,2026-03-04 12:38:41 -0800,"<p>Ah...Just found material about Gmail's need for ""recent:"" With multiple devices. Solved, I think. </p>",Luddite,false,0,0
1803725,1568847,2026-03-04 07:24:23 -0800,2026-03-04 07:24:23 -0800,"<p>You can find steps to configure an alias in Thunderbird desktop linked below. </p><p><a href=""https://support.mozilla.org/en-US/kb/configuring-email-aliases"" rel=""nofollow"">https://support.mozilla.org/en-US/kb/configuring-email-aliases</a> </p><p>In the Android app, navigate to settings &gt; account &gt; sending mail &gt; manage identities. </p>",platform34,false,0,0
